name,address,contact_person,contact_no,email,username
DSWD FO XI (Regional Office),"D. Suazo St. Cor. R. Magsaysay Ave., Davao City",,,,
SWAD Davao City,"3rd District Office, Old Barangay Hall, Mintal Davao City",,,ciu.fo11@dswd.gov,ciudvocity
SWAD Davao Del Sur,"Ground Floor Wilvil Building corner G. Lim, 6th St (near AMESCO)",Nida Bolilan,9105887008,ciudds11@gmail.com,ciudds
SWAD Davao Oriental,"Capitol Hills (beside PCSO), Barangay Central, Mati City, Davao Oriental",,,ciudavor@gmail.com,ciudavor
SWAD Davao de Oro,"Purok 14, Poblacion, Nabunturan, Davao de Oro (near Comval Hotel along national highway)",Analyn Romero,9173893975,ciucomval@gmail.com,ciucomval
SWAD Davao Del Norte,"Macario P. Bermudez St. (beside Rubio Funeral Homes), Tagum City",Candelaria Tingson,9976300694,ciudavnor@gmail.com,ciudavnor
SWAD Davao Occidental,"Davao Occidental Provincial Capitol Compound, Malita",Arris Medrano,0956 0322987,dswdciudocc@gmail.com,ciudocc
